{
  "schema_version": "plamen.mechanical_gate_registry_candidate.provisional.v1",
  "status": "PROVISIONAL_UNWRAPPED_UNREVIEWED",
  "runtime_authority_granted": false,
  "authoritative_registry": {
    "path": "rules/mechanical-gate-registry.json",
    "sha256": "5acf9a848bae74ab256872600324098e1472bff73fdcb0233923f6c5dac5157e",
    "schema_version": "plamen.mechanical_gate_registry.v1"
  },
  "source_snapshot": {
    "source_tree_digest_algorithm": "sha256:plamen-source-tree-v1",
    "source_tree_digest": "605041aff4c9dc4cddf848af9fe71d7e7d5399487f9a89a7e2d624294489c9c6",
    "digest_stability": "REGENERATE_AT_TREE_FREEZE",
    "git_head": "67a0f85adc7a8169d79a286908b00bef7adb764a",
    "files": [
      {
        "path": "scripts/audit_snapshot.py",
        "sha256": "ea80ce08577f68eaad1d1b3c4d06c237d87e3a4d6db5fcda1435bb582561fe53"
      },
      {
        "path": "scripts/enumeration_gate.py",
        "sha256": "084b5604c8d48a1a321549bd987d66578a6cc86ce088402cd8162c92df14ec7c"
      },
      {
        "path": "scripts/mandatory_reverification.py",
        "sha256": "a786942c9efbd1e959969091f5ed5bb8def2246adcc042a7085f84de68690bad"
      },
      {
        "path": "scripts/mechanical_verify.py",
        "sha256": "c083898e011c7cb9a1f224edd3dda4b9fb40ec8f07465d355a64df7524418d2c"
      },
      {
        "path": "scripts/phase_io_contracts.py",
        "sha256": "ec4d4872f4f217a333fc0a5006b127a715b275bf69a402d9386f4a1ff662b9fd"
      },
      {
        "path": "scripts/plamen_driver.py",
        "sha256": "45aa2ebe92f85688e52f8886d6e75db17157d7d44bcbfa919cc4381ef51d3c69"
      },
      {
        "path": "scripts/plamen_mechanical.py",
        "sha256": "d24409338ef4d1a4c2a0b9e026b5f59f4521ec6ca8c2c56027e543e7c8abdf72"
      },
      {
        "path": "scripts/plamen_validators.py",
        "sha256": "20e4c437670d4e3c7575bcd5c360a59b96070870b7cc95e791901208c0fa7313"
      },
      {
        "path": "scripts/post_verify_lifecycle.py",
        "sha256": "fbc67412f5ca9a54c5d775bf2d4d2fb2db75985e5e1248e34e27827b7996142f"
      },
      {
        "path": "scripts/recon_prepass.py",
        "sha256": "86d1adca34a61c22fef34876b21573b854892ef1a7b98076890a3fa9037653c8"
      },
      {
        "path": "scripts/report_disposition_authority.py",
        "sha256": "46624f1f5f131d0e293c4421c4e3cebc14ccd486a671716ee4997f5052e6fbc2"
      },
      {
        "path": "scripts/supply_chain_gate.py",
        "sha256": "929c6aa88978907050a2b5e16e8d2c8a6037f15adf58a9d12ffd519b42bb420c"
      }
    ]
  },
  "independent_review_receipt_sha256": null,
  "scope": {
    "baseline_semantics": "MINIMUM_INDEPENDENT_DECISION_AUTHORITIES",
    "included_authorities": [
      "CANDIDATE_MEMBERSHIP",
      "DISPOSITION_OR_REPORT_TIER",
      "EVIDENCE_OR_SUCCESSOR_AUTHORITY",
      "OBLIGATION_LIFECYCLE",
      "SEVERITY",
      "SHIP_AUTHORITY",
      "TARGET_EXECUTION",
      "VERIFICATION_ROUTING"
    ],
    "excluded_controls": [
      "MODEL_JUDGMENT",
      "NON_PRODUCTION_CODE",
      "PURE_DATA_UTILITIES",
      "STRUCTURAL_SELF_VALIDATION",
      "TRANSACTION_MECHANICS",
      "UNCONSUMED_TOOL_OUTPUT"
    ],
    "known_broader_validator_inventory_debt": true
  },
  "gate_count": 33,
  "gate_records": [
    {
      "forensic_id": "MG-001",
      "gate_id": "supply_chain.pre_input_execution",
      "display_name": "Supply-chain gate before input preparation",
      "owning_seam": "STARTUP_RESUME",
      "decision_class": "PIPELINE_INTEGRITY",
      "direction": "BLOCK_EXECUTION",
      "candidate_lifecycle_state": "LEGACY_ACTIVE_UNGOVERNED",
      "activation_ids": [
        "supply_chain.pre_input_execution.recon_prepass"
      ],
      "component_owner": null,
      "system_owner": null,
      "independent_reviewer": null,
      "admission_evidence_receipt_sha256": null,
      "part0_status": "PASS_GENERIC_METADATA_ONLY"
    },
    {
      "forensic_id": "MG-002",
      "gate_id": "supply_chain.pre_poc_execution",
      "display_name": "Supply-chain gate before PoC execution",
      "owning_seam": "POST_VERIFY",
      "decision_class": "PIPELINE_INTEGRITY",
      "direction": "BLOCK_EXECUTION",
      "candidate_lifecycle_state": "LEGACY_ACTIVE_UNGOVERNED",
      "activation_ids": [
        "supply_chain.pre_poc_execution.mechanical_verify"
      ],
      "component_owner": null,
      "system_owner": null,
      "independent_reviewer": null,
      "admission_evidence_receipt_sha256": null,
      "part0_status": "PASS_GENERIC_METADATA_ONLY"
    },
    {
      "forensic_id": "MG-003",
      "gate_id": "snapshot.startup_binding",
      "display_name": "Startup snapshot binding",
      "owning_seam": "STARTUP_RESUME",
      "decision_class": "PIPELINE_INTEGRITY",
      "direction": "BLOCK_EXECUTION",
      "candidate_lifecycle_state": "LEGACY_ACTIVE_UNGOVERNED",
      "activation_ids": [
        "snapshot.startup_binding.driver"
      ],
      "component_owner": null,
      "system_owner": null,
      "independent_reviewer": null,
      "admission_evidence_receipt_sha256": null,
      "part0_status": "PASS_GENERIC_METADATA_ONLY"
    },
    {
      "forensic_id": "MG-004",
      "gate_id": "snapshot.interphase_drift",
      "display_name": "Inter-phase source drift",
      "owning_seam": "STARTUP_RESUME",
      "decision_class": "PIPELINE_INTEGRITY",
      "direction": "BLOCK_EXECUTION",
      "candidate_lifecycle_state": "LEGACY_ACTIVE_UNGOVERNED",
      "activation_ids": [
        "snapshot.interphase_drift.driver"
      ],
      "component_owner": null,
      "system_owner": null,
      "independent_reviewer": null,
      "admission_evidence_receipt_sha256": null,
      "part0_status": "PASS_GENERIC_METADATA_ONLY"
    },
    {
      "forensic_id": "MG-005",
      "gate_id": "enumeration.graph_health",
      "display_name": "Enumeration graph-health decision",
      "owning_seam": "POST_DISCOVERY",
      "decision_class": "PIPELINE_INTEGRITY",
      "direction": "FLAG_TELEMETRY",
      "candidate_lifecycle_state": "LEGACY_ACTIVE_UNGOVERNED",
      "activation_ids": [
        "enumeration.graph_health.accepted_depth"
      ],
      "component_owner": null,
      "system_owner": null,
      "independent_reviewer": null,
      "admission_evidence_receipt_sha256": null,
      "part0_status": "PASS_GENERIC_METADATA_ONLY"
    },
    {
      "forensic_id": "MG-006",
      "gate_id": "enumeration.coreference_obligation",
      "display_name": "Co-reference obligation enumeration",
      "owning_seam": "POST_DISCOVERY",
      "decision_class": "RECALL_GENERATOR",
      "direction": "GENERATE_ADD_ONLY",
      "candidate_lifecycle_state": "LEGACY_ACTIVE_UNGOVERNED",
      "activation_ids": [
        "enumeration.coreference_obligation.accepted_depth"
      ],
      "component_owner": null,
      "system_owner": null,
      "independent_reviewer": null,
      "admission_evidence_receipt_sha256": null,
      "part0_status": "PASS_GENERIC_METADATA_ONLY"
    },
    {
      "forensic_id": "MG-007",
      "gate_id": "enumeration.coreference_gap",
      "display_name": "Co-reference coverage-gap candidate",
      "owning_seam": "POST_DISCOVERY",
      "decision_class": "RECALL_GENERATOR",
      "direction": "GENERATE_ADD_ONLY",
      "candidate_lifecycle_state": "LEGACY_ACTIVE_UNGOVERNED",
      "activation_ids": [
        "enumeration.coreference_gap.accepted_depth"
      ],
      "component_owner": null,
      "system_owner": null,
      "independent_reviewer": null,
      "admission_evidence_receipt_sha256": null,
      "part0_status": "PASS_GENERIC_METADATA_ONLY"
    },
    {
      "forensic_id": "MG-008",
      "gate_id": "enumeration.critical_asset_mover",
      "display_name": "Critical-asset-mover candidate",
      "owning_seam": "POST_DISCOVERY",
      "decision_class": "RECALL_GENERATOR",
      "direction": "GENERATE_ADD_ONLY",
      "candidate_lifecycle_state": "LEGACY_ACTIVE_UNGOVERNED",
      "activation_ids": [
        "enumeration.critical_asset_mover.accepted_depth"
      ],
      "component_owner": null,
      "system_owner": null,
      "independent_reviewer": null,
      "admission_evidence_receipt_sha256": null,
      "part0_status": "PASS_GENERIC_METADATA_ONLY"
    },
    {
      "forensic_id": "MG-009",
      "gate_id": "enumeration.array_uniqueness",
      "display_name": "Array-uniqueness candidate",
      "owning_seam": "POST_DISCOVERY",
      "decision_class": "RECALL_GENERATOR",
      "direction": "GENERATE_ADD_ONLY",
      "candidate_lifecycle_state": "LEGACY_ACTIVE_UNGOVERNED",
      "activation_ids": [
        "enumeration.array_uniqueness.accepted_depth"
      ],
      "component_owner": null,
      "system_owner": null,
      "independent_reviewer": null,
      "admission_evidence_receipt_sha256": null,
      "part0_status": "PASS_GENERIC_METADATA_ONLY"
    },
    {
      "forensic_id": "MG-010",
      "gate_id": "enumeration.unbounded_stored_input",
      "display_name": "Unbounded stored-input candidate",
      "owning_seam": "POST_DISCOVERY",
      "decision_class": "RECALL_GENERATOR",
      "direction": "GENERATE_ADD_ONLY",
      "candidate_lifecycle_state": "LEGACY_ACTIVE_UNGOVERNED",
      "activation_ids": [
        "enumeration.unbounded_stored_input.accepted_depth"
      ],
      "component_owner": null,
      "system_owner": null,
      "independent_reviewer": null,
      "admission_evidence_receipt_sha256": null,
      "part0_status": "PASS_GENERIC_METADATA_ONLY"
    },
    {
      "forensic_id": "MG-011",
      "gate_id": "enumeration.variant_boundary",
      "display_name": "Boundary-variant candidate",
      "owning_seam": "POST_DISCOVERY",
      "decision_class": "RECALL_GENERATOR",
      "direction": "GENERATE_ADD_ONLY",
      "candidate_lifecycle_state": "LEGACY_ACTIVE_UNGOVERNED",
      "activation_ids": [
        "enumeration.variant_boundary.accepted_depth"
      ],
      "component_owner": null,
      "system_owner": null,
      "independent_reviewer": null,